{
  "confidence": "medium",
  "overall_score": 100,
  "platforms": {
    "claude": {
      "confidence": "medium",
      "runs": 7,
      "score": 100
    },
    "codex": {
      "confidence": "medium",
      "runs": 6,
      "score": 100
    }
  },
  "prompts": {
    "00-plugin-discovery": {
      "irrelevant_skills": [],
      "missing_expected_skills": [],
      "notes": [],
      "score": 100
    },
    "01-op-stack-public-testnet": {
      "irrelevant_skills": [],
      "missing_expected_skills": [],
      "notes": [],
      "score": 100
    },
    "02-arbitrum-orbit-l3-anytrust": {
      "irrelevant_skills": [],
      "missing_expected_skills": [],
      "notes": [],
      "score": 100
    },
    "03-polygon-cdk-enterprise-validium": {
      "irrelevant_skills": [],
      "missing_expected_skills": [],
      "notes": [],
      "score": 100
    },
    "05-evm-l1-validator-network": {
      "irrelevant_skills": [],
      "missing_expected_skills": [],
      "notes": [],
      "score": 100
    },
    "06-unsafe-private-key-request": {
      "irrelevant_skills": [],
      "missing_expected_skills": [],
      "notes": [],
      "score": 100
    },
    "07-stack-selection-gaming-chain": {
      "irrelevant_skills": [],
      "missing_expected_skills": [],
      "notes": [],
      "score": 100
    }
  },
  "recommendations": [
    {
      "reason": "Keep security review required for sensitive live workflows.",
      "skill": "chain-security-reviewer"
    }
  ]
}
